{
  "id": "example_level",
  "name": "Example Level",
  "waves": [],
  "waiting_slots": 5,
  "front_rows_visible": 3,
  "columns": [
    {
      "id": "A",
      "units": ["A1", "A2", "A3", "A4"]
    },
    {
      "id": "B",
      "units": ["B1", "B2", "B3", "B4"]
    }
  ],
  "buildings": [
    {
      "color": "B",
      "layer_depth": 1
    },
    {
      "color": "B",
      "layer_depth": 2
    },
    {
      "color": "A",
      "layer_depth": 1
    }
  ]
}
